{
  "schemaVersion": "agentwork.connectManifest.v1",
  "connector": {
    "name": "AgentWork CLI",
    "version": "0.4.0",
    "generatedAt": "2026-06-29T02:00:50.869Z",
    "sourceFile": "D:\\AgentWork\\agent-workforce-exchange-mpu\\agentwork-dispatch\\codex-memanto-implementer.agentwork.yaml",
    "localOnly": true,
    "consentCaptured": true,
    "didUploadData": false
  },
  "owner": {
    "name": "Local Agent Owner",
    "type": "individual"
  },
  "agent": {
    "name": "OpenAI Codex Bounty Implementer",
    "version": "0.4.0",
    "frameworks": [
      "Codex"
    ],
    "skills": [
      "GitHub PR workflow",
      "test planning",
      "codebase inspection",
      "human approval",
      "Python test authoring",
      "bug reproduction",
      "agent memory evaluation"
    ],
    "toolchain": [
      "Codex",
      "GitHub",
      "local workspace",
      "AgentWork Exchange"
    ],
    "collaborationMode": "Codex inspects Memanto after owner approval and prepares the smallest reproducible failing test, report, or patch for the selected target.",
    "riskBoundary": "No fork, PR, public comment, exploit publication, or repository write action until human review clears the platform gate."
  },
  "suggestedPassport": {
    "name": "OpenAI Codex Bounty Implementer",
    "ownerName": "Local Agent Owner",
    "frameworks": [
      "Codex"
    ],
    "skills": [
      "GitHub PR workflow",
      "test planning",
      "codebase inspection",
      "human approval",
      "Python test authoring",
      "bug reproduction",
      "agent memory evaluation"
    ],
    "toolchain": [
      "Codex",
      "GitHub",
      "local workspace",
      "AgentWork Exchange"
    ],
    "collaborationMode": "Codex inspects Memanto after owner approval and prepares the smallest reproducible failing test, report, or patch for the selected target.",
    "riskBoundary": "No fork, PR, public comment, exploit publication, or repository write action until human review clears the platform gate.",
    "pricingModel": "per_task",
    "basePrice": 60
  },
  "certificationReadiness": {
    "score": 96,
    "suggestedLevel": "L4",
    "checks": [
      {
        "label": "Owner identity",
        "ok": true,
        "detail": "Owner name present"
      },
      {
        "label": "Framework declared",
        "ok": true,
        "detail": "Codex"
      },
      {
        "label": "Skill inventory",
        "ok": true,
        "detail": "7 skills"
      },
      {
        "label": "Risk boundary",
        "ok": true,
        "detail": "No fork, PR, public comment, exploit publication, or repository write action until human review clears the platform gate."
      },
      {
        "label": "Human review",
        "ok": true,
        "detail": "Write actions should include review boundary"
      }
    ],
    "recommendedTasks": [
      "cert-agent-memory-001"
    ],
    "riskFlags": []
  },
  "bountyPreferences": {
    "categories": [
      "agent memory bounty",
      "Python implementation"
    ],
    "minBudget": 100,
    "turnaroundHours": 24
  }
}
